{
  "schemaVersion": "1.0.0",
  "experienceId": "synthetic-incident-resolution",
  "narrativeAnchor": "Resolve one synthetic incident from intake through executive reporting.",
  "personas": [
    {
      "id": "operator",
      "label": "Operations lead",
      "outcome": "Resolve the incident with verified evidence.",
      "cta": {
        "label": "Launch synthetic workspace",
        "destination": "/sandbox/operator"
      }
    },
    {
      "id": "executive",
      "label": "Executive owner",
      "outcome": "Verify resolution, control, and business impact.",
      "cta": {
        "label": "Review verified impact",
        "destination": "/sandbox/executive"
      }
    }
  ],
  "proofAssets": [
    {
      "id": "incident-loop",
      "type": "video-loop",
      "path": "media/incident-loop.mp4",
      "sha256": "aaaaaaaaaaaaaaaaaaaaaaaaaaaaaaaaaaaaaaaaaaaaaaaaaaaaaaaaaaaaaaaa",
      "evidenceIds": ["candidate-evidence"],
      "posterFallback": "media/incident-loop-poster.png"
    }
  ],
  "scenes": [
    {
      "id": "intake",
      "sequence": 1,
      "phase": "Intake",
      "title": "A real-looking synthetic incident arrives",
      "personaIds": ["operator", "executive"],
      "deepLink": "#intake",
      "proofAssetId": "incident-loop",
      "trustControl": "Synthetic-data badge stays adjacent to the incident.",
      "metrics": []
    },
    {
      "id": "triage",
      "sequence": 2,
      "phase": "Triage",
      "title": "The operator verifies the suggested priority",
      "personaIds": ["operator"],
      "deepLink": "#triage",
      "proofAssetId": "incident-loop",
      "trustControl": "The recommendation requires operator confirmation.",
      "metrics": [],
      "automationDisclosure": {
        "sourceClasses": ["synthetic incident record", "approved runbook"],
        "confidenceLabel": "High confidence",
        "limitations": "The recommendation does not execute a change.",
        "humanControl": "The operator approves or rejects the priority."
      }
    },
    {
      "id": "resolution",
      "sequence": 3,
      "phase": "Resolution",
      "title": "The workflow reaches the protected hero moment",
      "personaIds": ["operator", "executive"],
      "deepLink": "#resolution",
      "proofAssetId": "incident-loop",
      "trustControl": "Rollback remains visible beside the action.",
      "metrics": [
        {
          "label": "Synthetic fixture elapsed time",
          "value": "42 seconds",
          "evidenceId": "timing-evidence"
        }
      ]
    },
    {
      "id": "verification",
      "sequence": 4,
      "phase": "Verification",
      "title": "The operator confirms the visible payoff",
      "personaIds": ["operator"],
      "deepLink": "#verification",
      "proofAssetId": "incident-loop",
      "trustControl": "The result is checksum-bound to the evidence package.",
      "metrics": []
    },
    {
      "id": "reporting",
      "sequence": 5,
      "phase": "Reporting",
      "title": "The executive sees the verified outcome",
      "personaIds": ["executive"],
      "deepLink": "#reporting",
      "proofAssetId": "incident-loop",
      "trustControl": "The report links back to the immutable audit evidence.",
      "metrics": []
    }
  ],
  "navigation": {
    "personaRouter": true,
    "stickyJourneyProgress": true,
    "directSceneLinks": true,
    "persistentContextualCta": true,
    "safeAreaValidated": true
  },
  "instrumentation": [
    "role_selected",
    "scene_viewed",
    "proof_interacted",
    "cta_clicked",
    "media_completed"
  ],
  "safety": {
    "syntheticDataOnly": true,
    "noExternalSideEffects": true,
    "keyboardAccessible": true,
    "reducedMotionSupported": true,
    "sandboxIsolation": "synthetic-only"
  }
}
